{
  "schema_version": 1,
  "id": 1,
  "name": "ISS-class truss",
  "vessel_type": {
    "kind": "space",
    "value": {
      "kind": "space_station",
      "modules": 5
    }
  },
  "construction_method": "orbital_assembly",
  "build_phases": [
    {
      "id": 1,
      "name": "On-orbit truss assembly",
      "activities": [
        {
          "id": 1,
          "name": "Deploy bay 1",
          "activity_type": {
            "kind": "join_block"
          },
          "dependencies": [],
          "duration_hours": 6,
          "resources": []
        },
        {
          "id": 2,
          "name": "Deploy bay 2",
          "activity_type": {
            "kind": "join_block"
          },
          "dependencies": [
            1
          ],
          "duration_hours": 6,
          "resources": []
        },
        {
          "id": 3,
          "name": "Deploy bay 3",
          "activity_type": {
            "kind": "join_block"
          },
          "dependencies": [
            2
          ],
          "duration_hours": 6,
          "resources": []
        }
      ],
      "structural_state": {
        "kind": "not_started"
      },
      "weight_state": {
        "design_kg": 7500,
        "installed_kg": 0
      },
      "duration_days": 45
    }
  ],
  "current_phase": 1
}
